{
  "schema_version": 1,
  "version": 1,
  "pipeline_version": "v6",
  "run_id": "qualify-publish-2025-10-11-20251011100522.-fba931be",
  "date": "2025-10-11",
  "source": "github",
  "generated_at": "2025-10-11T10:05:22.174Z",
  "updated_at": "2025-10-11T10:05:22.174Z",
  "published_at": "2025-10-11T10:05:22.174Z",
  "stats": {
    "total": 0,
    "qualified": 0,
    "passonce": 0,
    "coverage_pct": 0,
    "duplicates": 0,
    "source_total": 0
  },
  "items": []
}
