{
  "schema_version": 1,
  "version": 1,
  "pipeline_version": "v6",
  "run_id": "qualify-publish-2025-11-02-20251102030236.-67084e32",
  "date": "2025-11-02",
  "source": "huggingface",
  "generated_at": "2025-11-02T03:02:36.340Z",
  "updated_at": "2025-11-02T03:02:36.340Z",
  "published_at": "2025-11-02T03:02:36.340Z",
  "stats": {
    "total": 1,
    "qualified": 1,
    "passonce": 0,
    "coverage_pct": 1,
    "duplicates": 0,
    "source_total": 1
  },
  "items": [
    {
      "canonical_id": "huggingface:nlpconnect/vit-gpt2-image-captioning",
      "promptHash": "sha256:f617770ecbe23cd0e894a1f9c9519917ef322dece72dbb44f45a5ea127e1d0f7",
      "summary_version": 1,
      "status": "qualified",
      "name": "vit-gpt2-image-captioning",
      "url": "https://huggingface.co/nlpconnect/vit-gpt2-image-captioning",
      "source": "huggingface",
      "tags": [
        "transformers",
        "pytorch",
        "vision-encoder-decoder",
        "image-to-text",
        "image-captioning",
        "doi:10.57967/hf/0222",
        "license:apache-2.0",
        "endpoints_compatible",
        "region:us"
      ],
      "summary_short": {
        "zh": "Vit-GPT2图像描述模型是一个将视觉内容转化为自然语言描述的智能系统，解决了图像理解与文本生成之间的语义鸿沟问题。该模型采用Vision Transformer提取图像特征，再通过GPT-2解码器生成连贯的文字描述，实现了从像素到语义的端到端处理。开发者可通过Hugging Face接口快速调用该模型为图片添加说明，或基于特定领域数据微调模型，应用于智能相册管理、无障碍辅助工具等场景，让计算机真正'看懂'图像内容。",
        "en": "Vit-GPT2 Image Captioning is a vision-language model that automatically generates descriptive text for images, bridging visual understanding with natural language. It combines Vision Transformer (ViT) for image feature extraction with GPT-2 for text generation, enabling coherent…",
        "es": "Vit-GPT2 Image Captioning is a vision-language model that automatically generates descriptive text for images, bridging visual understanding with natural language. It combines Vision Transformer (ViT) for image feature extraction with GPT-2 for text generation, enabling coherent…"
      },
      "summaries": {
        "zh": "Vit-GPT2图像描述模型是一个将视觉内容转化为自然语言描述的智能系统，解决了图像理解与文本生成之间的语义鸿沟问题。该模型采用Vision Transformer提取图像特征，再通过GPT-2解码器生成连贯的文字描述，实现了从像素到语义的端到端处理。开发者可通过Hugging Face接口快速调用该模型为图片添加说明，或基于特定领域数据微调模型，应用于智能相册管理、无障碍辅助工具等场景，让计算机真正'看懂'图像内容。",
        "en": "Vit-GPT2 Image Captioning is a vision-language model that automatically generates descriptive text for images, bridging visual understanding with natural language. It combines Vision Transformer (ViT) for image feature extraction with GPT-2 for text generation, enabling coherent caption production from pixel inputs. You can use it via Hugging Face's pipeline API to caption photos, enhance accessibility tools, or fine-tune it on domain-specific datasets for customized image description tasks.",
        "es": "Vit-GPT2 Image Captioning is a vision-language model that automatically generates descriptive text for images, bridging visual understanding with natural language. It combines Vision Transformer (ViT) for image feature extraction with GPT-2 for text generation, enabling coherent caption production from pixel inputs. You can use it via Hugging Face's pipeline API to caption photos, enhance accessibility tools, or fine-tune it on domain-specific datasets for customized image description tasks."
      },
      "locales": [
        "en",
        "zh",
        "es"
      ],
      "provider": {
        "name": "deepseek-tri",
        "version": "1.0.0",
        "mode": "json_single"
      },
      "quality": {
        "score": 0.92,
        "fallback": false,
        "length": {
          "en": 496,
          "zh": 211,
          "es": 496
        },
        "warnings": [
          "es_short:0"
        ],
        "accepted_at": "2025-11-02T03:01:36.020Z"
      },
      "stats": {
        "downloads_total": 2088166,
        "likes_total": 916
      },
      "metadata": {
        "license": "N/A",
        "lang": "N/A",
        "categories": {
          "capabilities": [],
          "scenes": [],
          "lifecycle": []
        }
      },
      "created_at": "2025-11-02T03:01:36.020Z",
      "updated_at": "2025-11-02T03:01:36.020Z",
      "first_seen": "2025-11-02T03:01:36.020Z",
      "last_seen": "2025-11-02T03:01:36.020Z",
      "tasks": [
        "multimodal_understanding_generation",
        "text_to_image"
      ]
    }
  ]
}
