{
  "schema_version": 1,
  "version": 1,
  "pipeline_version": "v6",
  "run_id": "qualify-publish-2025-10-27-20251027030437.-76625a6c",
  "date": "2025-10-27",
  "source": "github",
  "generated_at": "2025-10-27T03:04:37.228Z",
  "updated_at": "2025-10-27T03:04:37.228Z",
  "published_at": "2025-10-27T03:04:37.228Z",
  "stats": {
    "total": 1,
    "qualified": 1,
    "passonce": 0,
    "coverage_pct": 1,
    "duplicates": 0,
    "source_total": 1
  },
  "items": [
    {
      "canonical_id": "github:astral-sh/uv",
      "promptHash": "sha256:2fe5178faac1c8c77c081dfb57279f19274b2f93665237a3c7dfa2ec31735b45",
      "summary_version": 1,
      "status": "qualified",
      "name": "uv",
      "url": "https://github.com/astral-sh/uv",
      "source": "github",
      "tags": [
        "packaging",
        "python",
        "resolver",
        "uv"
      ],
      "summary_short": {
        "zh": "uv 是一个用 Rust 编写的极速 Python 包和项目管理器，解决了传统工具在依赖解析和安装时的性能瓶颈。其核心技术在于利用 Rust 的语言特性和创新的解析算法，能够高效处理复杂的依赖关系图，比传统工具快数倍。开发者可以将其作为 pip 和 pip-tools 的直接替代品，用于快速创建虚拟环境、安装依赖包以及生成可靠的依赖锁文件，特别适合需要频繁切换项目或追求高效 CI/CD 流程的团队。",
        "en": "uv is an extremely fast Python package and project manager written in Rust that solves dependency resolution and installation bottlenecks. Its speed comes from Rust's performance advantages and a novel resolver algorithm that handles complex dependency graphs efficiently. You ca…",
        "es": "uv is an extremely fast Python package and project manager written in Rust that solves dependency resolution and installation bottlenecks. Its speed comes from Rust's performance advantages and a novel resolver algorithm that handles complex dependency graphs efficiently. You ca…"
      },
      "summaries": {
        "zh": "uv 是一个用 Rust 编写的极速 Python 包和项目管理器，解决了传统工具在依赖解析和安装时的性能瓶颈。其核心技术在于利用 Rust 的语言特性和创新的解析算法，能够高效处理复杂的依赖关系图，比传统工具快数倍。开发者可以将其作为 pip 和 pip-tools 的直接替代品，用于快速创建虚拟环境、安装依赖包以及生成可靠的依赖锁文件，特别适合需要频繁切换项目或追求高效 CI/CD 流程的团队。",
        "en": "uv is an extremely fast Python package and project manager written in Rust that solves dependency resolution and installation bottlenecks. Its speed comes from Rust's performance advantages and a novel resolver algorithm that handles complex dependency graphs efficiently. You can use it as a drop-in replacement for pip and pip-tools to dramatically accelerate development workflows, manage virtual environments, and lock dependencies for reproducible builds across projects.",
        "es": "uv is an extremely fast Python package and project manager written in Rust that solves dependency resolution and installation bottlenecks. Its speed comes from Rust's performance advantages and a novel resolver algorithm that handles complex dependency graphs efficiently. You can use it as a drop-in replacement for pip and pip-tools to dramatically accelerate development workflows, manage virtual environments, and lock dependencies for reproducible builds across projects."
      },
      "locales": [
        "en",
        "zh",
        "es"
      ],
      "provider": {
        "name": "deepseek-tri",
        "version": "1.0.0",
        "mode": "json_single"
      },
      "quality": {
        "score": 0.92,
        "fallback": false,
        "length": {
          "en": 476,
          "zh": 201,
          "es": 476
        },
        "warnings": [
          "es_short:0"
        ],
        "accepted_at": "2025-10-27T03:03:32.062Z"
      },
      "stats": {
        "stars": 71023,
        "forks": 2159,
        "issues": 2368
      },
      "metadata": {
        "license": "Apache-2.0",
        "lang": "Rust",
        "categories": {
          "capabilities": [],
          "scenes": [],
          "lifecycle": []
        }
      },
      "created_at": "2025-10-27T03:03:32.062Z",
      "updated_at": "2025-10-27T03:03:32.062Z",
      "first_seen": "2025-10-27T03:03:32.062Z",
      "last_seen": "2025-10-27T03:03:32.062Z",
      "tasks": [],
      "project_categories": [
        "agents_workflows",
        "ui_devex"
      ]
    }
  ]
}
